EDID.sh start to run in: 2025-06-04 05:49:52  +0800
[  [1;32mOK[0m  ]  Verify the amount of monitor ...                            
Extracted contents:
header:          00 ff ff ff ff ff ff 00
serial number:   36 69 a1 40 e8 01 00 00 29 21
version:         01 03
basic params:    68 35 1e 78 2a
chroma info:     19 95 a8 55 50 9e 26 0c 50 54
established:     bf ef 00
standard:        d1 c0 b3 00 95 00 81 80 81 40 81 c0 01 01 01 01
descriptor 1:    02 3a 80 18 71 38 2d 40 58 2c 45 00 0f 28 21 00 00 1e
descriptor 2:    00 00 00 ff 00 50 41 31 54 38 37 33 41 30 30 34 38 38
descriptor 3:    00 00 00 fc 00 4d 53 49 20 4d 50 32 34 32 41 0a 20 20
descriptor 4:    00 00 00 fd 00 30 4b 1e 55 12 00 0a 20 20 20 20 20 20
extensions:      00
checksum:        44

Manufacturer: MSI Model 40a1 Serial Number 488
Made week 41 of 2023
EDID version: 1.3
Analog display, Input voltage level: 0.7/0.7 V
Sync: Separate 
Maximum image size: 53 cm x 30 cm
Gamma: 2.20
DPMS levels: Off
RGB color display
First detailed timing is preferred timing
Established timings supported:
  720x400@70Hz
  640x480@60Hz
  640x480@67Hz
  640x480@72Hz
  640x480@75Hz
  800x600@56Hz
  800x600@60Hz
  800x600@72Hz
  800x600@75Hz
  832x624@75Hz
  1024x768@60Hz
  1024x768@70Hz
  1024x768@75Hz
  1280x1024@75Hz
Standard timings supported:
  1920x1080@60Hz
  1680x1050@60Hz
  1440x900@60Hz
  1280x1024@60Hz
  1280x960@60Hz
  1280x720@60Hz
Detailed mode: Clock 148.500 MHz, 527 mm x 296 mm
               1920 2008 2052 2200 hborder 0
               1080 1084 1089 1125 vborder 0
               +hsync +vsync 
Serial number: PA1T873A00488
Monitor name: MSI MP242A
Monitor ranges (GTF): 48-75Hz V, 30-85kHz H, max dotclock 180MHz
Checksum: 0x44 (valid)
[  [1;32mOK[0m  ]  Decode the EDID of card0-VGA-1 ...                          
[  [1;32mOK[0m  ]  Get the version of EDID: 1.3 ...                            
[1;32m Check the EDID of monitor[0m[60G [[1;32m  PASS  [0;39m]
[1;32m----------------------------------------------------------------------[0m
/TestAP/SwitchDP/EDID.sh test pass in: 2025-06-04 05:49:52 CST
----------------------------------------------------------------------
